{
  "schema_version": 1,
  "run_id": "run_123e4567-e89b-42d3-a456-426614174000",
  "run_manifest_content_sha256": "sha256:1111111111111111111111111111111111111111111111111111111111111111",
  "published_at": "2026-08-24T15:54:00Z",
  "candidates_content_sha256": "sha256:1111111111111111111111111111111111111111111111111111111111111111",
  "registry_content_sha256": "sha256:1111111111111111111111111111111111111111111111111111111111111111",
  "dataset_artifact_sha256": "sha256:0000000000000000000000000000000000000000000000000000000000000000",
  "evaluation_policy_version": "1.0.0",
  "evaluation_policy_content_sha256": "sha256:1111111111111111111111111111111111111111111111111111111111111111",
  "taxonomy_version": "1.0.0",
  "taxonomy_content_sha256": "sha256:1111111111111111111111111111111111111111111111111111111111111111"
}
