{
  "schema_version": 1,
  "run_id": "run_cef4b822-d782-4a0e-bb0c-1930b1607fa5",
  "run_manifest_content_sha256": "sha256:f2815612e4e536a839e1ba3a5c50bec35c8a3b9a4cf254d065829388a420e5b7",
  "published_at": "2026-09-12T20:12:45Z",
  "candidates_content_sha256": "sha256:f9f6fddad531d33aa740c701e77508015fdbf7ca39d7bef144914b531436e40f",
  "registry_content_sha256": "sha256:0d02aeb819c1c48e2a4347fcba1a4f819c91f4fad26ce1dfd80c92ce2224d1ae",
  "dataset_artifact_sha256": "sha256:6b051b2b4f8780bba0e4752e967fc6025d14168139e128c9b9cd05b100d07c7e",
  "evaluation_policy_version": "1.0.0",
  "evaluation_policy_content_sha256": "sha256:edfd0c0ea09f60ea505999bd3985fc6e1a44a1f706486cf7c2a52a941d049dba",
  "taxonomy_version": "1.0.0",
  "taxonomy_content_sha256": "sha256:d79db026b946888661925307cf597c47b45ba7fcf86969cdcb2ce590fb5c1302"
}
